[
 {"event_id":"e01","task_id":"SIM-TASK","stage_id":"1","timestamp":"2026-08-30T00:00:00Z","timestamp_source":"SYSTEM_CLOCK","event_type":"STAGE_STARTED","detected_by":"orchestrator","evidence_refs":["stage1/start"],"correlation_id":"stage1-start"},
 {"event_id":"e02","task_id":"SIM-TASK","stage_id":"1","timestamp":"2026-08-30T00:01:00Z","timestamp_source":"SYSTEM_CLOCK","event_type":"STAGE_PASSED","detected_by":"gate","evidence_refs":["stage1/pass"],"correlation_id":"stage1-pass","first_pass":true},
 {"event_id":"e03","task_id":"SIM-TASK","stage_id":"2","timestamp":"2026-08-30T00:02:00Z","timestamp_source":"SYSTEM_CLOCK","event_type":"STAGE_STARTED","detected_by":"orchestrator","evidence_refs":["stage2/start"],"correlation_id":"stage2-start"},
 {"event_id":"e04","task_id":"SIM-TASK","stage_id":"2","timestamp":"2026-08-30T00:03:00Z","timestamp_source":"SYSTEM_CLOCK","event_type":"DRIFT_DETECTED","detected_by":"DRIFT_CHECK","evidence_refs":["stage2/drift"],"correlation_id":"drift-1","drift_type":"PLAN_SCOPE","expected":"synthetic fixture only","actual":"unapproved external source"},
 {"event_id":"e05","task_id":"SIM-TASK","stage_id":"2","timestamp":"2026-08-30T00:04:00Z","timestamp_source":"SYSTEM_CLOCK","event_type":"DRIFT_CORRECTED","detected_by":"DRIFT_CHECK","evidence_refs":["stage2/realigned"],"correlation_id":"drift-fix-1","source_drift_event_id":"e04"},
 {"event_id":"e06","task_id":"SIM-TASK","stage_id":"2","timestamp":"2026-08-30T00:05:00Z","timestamp_source":"SYSTEM_CLOCK","event_type":"STAGE_PASSED","detected_by":"gate","evidence_refs":["stage2/pass"],"correlation_id":"stage2-pass","first_pass":true},
 {"event_id":"e07","task_id":"SIM-TASK","stage_id":"3","timestamp":"2026-08-30T00:06:00Z","timestamp_source":"SYSTEM_CLOCK","event_type":"STAGE_STARTED","detected_by":"orchestrator","evidence_refs":["stage3/start"],"correlation_id":"stage3-start"},
 {"event_id":"e08","task_id":"SIM-TASK","stage_id":"3","timestamp":"2026-08-30T00:07:00Z","timestamp_source":"SYSTEM_CLOCK","event_type":"FAILURE_EVENT","detected_by":"test","evidence_refs":["stage3/fail-test"],"correlation_id":"failure-1","reason":"AI implementation error"},
 {"event_id":"e09","task_id":"SIM-TASK","stage_id":"3","timestamp":"2026-08-30T00:08:00Z","timestamp_source":"SYSTEM_CLOCK","event_type":"GATE_FAILED","detected_by":"gate","evidence_refs":["stage3/gate-fail"],"correlation_id":"gate-fail-1","gate_id":"STAGE3","reason":"test exit 1","blocking_condition":"implementation incorrect"},
 {"event_id":"e10","task_id":"SIM-TASK","stage_id":"3","timestamp":"2026-08-30T00:09:00Z","timestamp_source":"SYSTEM_CLOCK","event_type":"AI_REWORK_EVENT","detected_by":"test","evidence_refs":["stage3/rework"],"correlation_id":"rework-1","root_cause":"incorrect AI implementation","root_cause_category":"AI_ERROR","affected_work":["synthetic module"],"recovery_action":"repair implementation","outcome":"pending verification"},
 {"event_id":"e11","task_id":"SIM-TASK","stage_id":"3","timestamp":"2026-08-30T00:10:00Z","timestamp_source":"SYSTEM_CLOCK","event_type":"RECOVERY_ATTEMPT","detected_by":"recovery","evidence_refs":["stage3/recovery-attempt"],"correlation_id":"recovery-1","failure_event_id":"e08"},
 {"event_id":"e12","task_id":"SIM-TASK","stage_id":"3","timestamp":"2026-08-30T00:11:00Z","timestamp_source":"SYSTEM_CLOCK","event_type":"AUTO_RECOVERY_SUCCESS","detected_by":"test","evidence_refs":["stage3/new-pass"],"correlation_id":"recovery-success-1","failure_event_id":"e08","recovery_attempt_event_id":"e11","new_test_evidence":["stage3/new-pass"]},
 {"event_id":"e13","task_id":"SIM-TASK","stage_id":"3","timestamp":"2026-08-30T00:12:00Z","timestamp_source":"SYSTEM_CLOCK","event_type":"STAGE_REOPENED","detected_by":"orchestrator","evidence_refs":["stage3/reopen"],"correlation_id":"stage3-reopen"},
 {"event_id":"e14","task_id":"SIM-TASK","stage_id":"3","timestamp":"2026-08-30T00:13:00Z","timestamp_source":"SYSTEM_CLOCK","event_type":"STAGE_PASSED","detected_by":"gate","evidence_refs":["stage3/pass"],"correlation_id":"stage3-pass","first_pass":false},
 {"event_id":"e15","task_id":"SIM-TASK","stage_id":"4","timestamp":"2026-08-30T00:14:00Z","timestamp_source":"SYSTEM_CLOCK","event_type":"STAGE_STARTED","detected_by":"orchestrator","evidence_refs":["stage4/start"],"correlation_id":"stage4-start"},
 {"event_id":"e16","task_id":"SIM-TASK","stage_id":"4","timestamp":"2026-08-30T00:15:00Z","timestamp_source":"SYSTEM_CLOCK","event_type":"USER_SCOPE_CHANGE","detected_by":"user","evidence_refs":["stage4/user-change"],"correlation_id":"scope-change-1","root_cause_category":"USER_CHANGE","reason":"approved synthetic requirement change"},
 {"event_id":"e17","task_id":"SIM-TASK","stage_id":"4","timestamp":"2026-08-30T00:16:00Z","timestamp_source":"SYSTEM_CLOCK","event_type":"STAGE_PASSED","detected_by":"gate","evidence_refs":["stage4/pass"],"correlation_id":"stage4-pass","first_pass":true},
 {"event_id":"e18","task_id":"SIM-TASK","stage_id":"5","timestamp":"2026-08-30T00:17:00Z","timestamp_source":"SYSTEM_CLOCK","event_type":"STAGE_STARTED","detected_by":"orchestrator","evidence_refs":["stage5/start"],"correlation_id":"stage5-start"},
 {"event_id":"e19","task_id":"SIM-TASK","stage_id":"5","timestamp":"2026-08-30T00:18:00Z","timestamp_source":"SYSTEM_CLOCK","event_type":"FAKE_PASS_BLOCKED","detected_by":"evidence-gate","evidence_refs":["stage5/missing-evidence"],"correlation_id":"fake-pass-1","reason":"model summary without test evidence"},
 {"event_id":"e20","task_id":"SIM-TASK","stage_id":"5","timestamp":"2026-08-30T00:19:00Z","timestamp_source":"SYSTEM_CLOCK","event_type":"SUSPEND_EVENT","detected_by":"orchestrator","evidence_refs":["stage5/checkpoint"],"correlation_id":"suspend-1"},
 {"event_id":"e21","task_id":"SIM-TASK","stage_id":"5","timestamp":"2026-08-30T00:20:00Z","timestamp_source":"SYSTEM_CLOCK","event_type":"RESUME_EVENT","detected_by":"orchestrator","evidence_refs":["stage5/checkpoint"],"correlation_id":"resume-1"},
 {"event_id":"e22","task_id":"SIM-TASK","stage_id":"5","timestamp":"2026-08-30T00:21:00Z","timestamp_source":"SYSTEM_CLOCK","event_type":"STAGE_PASSED","detected_by":"gate","evidence_refs":["stage5/pass"],"correlation_id":"stage5-pass","first_pass":false},
 {"event_id":"e23","task_id":"SIM-TASK","stage_id":"FINAL","timestamp":"2026-08-30T00:22:00Z","timestamp_source":"SYSTEM_CLOCK","event_type":"PROJECT_COMPLETED","detected_by":"release-gate","evidence_refs":["final/pass"],"correlation_id":"project-complete"}
]
